<?xml version="1.0" ?>
<FFS xmlns:xsi="http://www.w3.org/2001/XMLSchema-instance" xsi:noNamespaceSchemaLocation="schema/config3.xsd">
	<!-- Logging section -->
	<Logging path="logs/" snapshotTime="2000" snapshotInConsole="true" statistics="false" logDataInOut="true" debugLogging="true" />

	<!-- Repository section -->
	<Repository>
		<Global>

		</Global>
		<Local>

		</Local>
	</Repository>

	<!-- Simulator plug-in section -->
	<Plugin class="cmg.tools.ffs.plugins.dummyplugin.DummyPlugin">
	</Plugin>

	<!-- Models section -->
	<Models>
		<Model name="M2">
			<Item repeat="1" delay="0" timeout="30000" type="out_sync">
				<Data name="returnType" value="0" datatype="String" />
			</Item>
			<Item repeat="1" delay="0" timeout="30000" type="out_sync">
				<Data name="returnType" value="1" datatype="String" />
			</Item>
			<Item repeat="1" delay="0" timeout="30000" type="out_sync" prevCondition="ok" >
			</Item>
		</Model>
	</Models>

	<!-- TrafficModels section -->
	<!-- 61200000 17h :), 57600000 16h -->
	<TrafficModel>
		<Slot times="1" duration="0" tps="0" activeModels="0">
			<Model name="M2" weight="100" />
		</Slot>
	</TrafficModel>
</FFS>