<?xml version="1.0" ?>
<FFS xmlns:xsi="http://www.w3.org/2001/XMLSchema-instance" xsi:noNamespaceSchemaLocation="schema/config3.xsd">
	<!-- Logging section -->
	<Logging path="logs/" snapshotTime="0" snapshotInConsole="false" statistics="false" logDataInOut="false" debugLogging="false" />

	<!-- Repository section -->
	<Repository>
		<Global>
			<Variable name="aIncreasingValue" type="Step" start="0" stepsize="1" datatype="Integer" />
			<Variable name="sleep" type="Fixed" value="100" datatype="Long" />
		</Global>
		<Local>
			<Variable name="aIncreasingValue" type="Step" start="0" stepsize="1" datatype="Integer" />
		</Local>
	</Repository>

	<!-- Simulator plug-in section -->
	<Plugin class="cmg.tools.ffs.plugins.dummyplugin.DummyPlugin">
		<Argument name="arg3" value="${Global.aIncreasingValue}" />
		<Argument name="arg2" value="${Global.sleep}" />
		<Argument name="arg1" value="Value_1_On_Argument" />
	</Plugin>

	<!-- Models section -->
	<Models>
		<Model name="M1">
			<Item repeat="1" delay="0" timeout="30000" type="out_sync">
				<Data name="sleep" value="${Global.sleep}" datatype="Long" />
				<Data name="sessionId" value="${Local.aIncreasingValue}" datatype="Integer" />
				<Data name="z" value="${Global.aIncreasingValue}" datatype="Integer" />
			</Item>
		</Model>
	</Models>

	<!-- TrafficModels section -->
	<TrafficModel>
		<Slot times="10" duration="0" tps="0" activeModels="0">
			<Model name="M1" weight="100" />
		</Slot>
	</TrafficModel>
</FFS>