<?xml version="1.0" ?>
<FFS xmlns:xsi="http://www.w3.org/2001/XMLSchema-instance" xsi:noNamespaceSchemaLocation="schema/config3.xsd">
	<!-- Logging section -->
	<Logging path="logs/" snapshotTime="2000" snapshotInConsole="true" statistics="false" logDataInOut="finest" debugLogging="600" />

	<!-- Repository section -->
	<Repository>
		<Global>
			<Variable name="gCount" type="Step" start="0" stepsize="1" datatype="Integer" />
		</Global>
		<Local>
			<Variable name="lCount" type="Step" start="0" stepsize="1" datatype="Integer" />
			<Variable name="lFixed" type="Fixed" value="${gCount}" datatype="Integer" />
		</Local>
	</Repository>

	<!-- Simulator plug-in section -->
	<Plugin class="cmg.tools.ffs.plugins.dummyplugin.DummyPlugin">
	</Plugin>

	<!-- Models section -->
	<Models>
		<Model name="M2" logLevel="finest">
			<Script>
				function log(msg) {
					_this.log(msg);
				};
			</Script>
			<Group repeat="2">
				<Item repeat="1" delay="1000" timeout="30000" type="out_sync">
					<Data name="log" value="${lFixed}, Item 1" datatype="String" />
				</Item>
				<Script engineName="JavaScript">
					log("tjo");
				</Script>
			</Group>
			<Script>
				log(lFixed+", lCount "+lCount.get()+ " hash: "+lCount.moduleHash());
				log(lFixed+", local_lCount "+local_lCount);
				log(lFixed+", gCount "+gCount.getCurrent());
				lCount.set(5);
			</Script>
			<Item repeat="1" delay="1000" timeout="30000" type="out_sync">
				<Data name="log" value="${lFixed}, Item 4 c${lCount}" datatype="String" />
			</Item>
			<Script>
				if(lCount.getCurrent() != 6)
				{
					log(lFixed+", lCount "+lCount.getCurrent()+ " hash: "+lCount.moduleHash());
					_this.result.markAsFailed();
				}
				else
				{
					log(lFixed+", lCount ok hash: "+lCount.moduleHash());
				}
			</Script>
		</Model>
	</Models>

	<!-- TrafficModels section -->
	<!-- 61200000 17h :), 57600000 16h -->
	<TrafficModel>
		<Slot times="1" duration="0" tps="0" activeModels="0">
			<Model name="M2" weight="100" />
		</Slot>
	</TrafficModel>
</FFS>